회사명,종목코드,업종,주요제품,대표자명,홈페이지,지역,대중적이름(추정),검색결과요약,홈페이지정보(요약),LLM_검증결과,LLM_검증근거
BGF리테일,282330,종합 소매업,체인화 편의점,이건준,http://www.bgfretail.com,서울특별시,CU,"Black Guerrilla Family - Wikipedia - The Black Guerrilla Family (BGF, also known as the Black Gorilla Family, [6][7] the Black Family, [8] the Black Vanguard, [9] and Jamaa[8]) is an African American black power prison gang, street gang, and …
Home - BGF Industries - BGF Industries is a US manufacturer of innovative technical fiber materials for global markets.
BGF - Growth Funding for Ambitious Businesses - BGF is the most active equity investor in the UK and Ireland. We exist to provide long-t","BGF리테일은 편의점 프랜차이즈 운영 시스템, 점포 경영 솔루션, 센트럴 키친, 토탈 물류 서비스 등을 제공하며, 온라인 플랫폼 '포켓CU'를 통해 온·오프라인 쇼핑 경험을 제공합니다. CU는 글로벌 시장으로 확장하고 있으며, 사회적 책임 활동에도 적극적으로 참여하고 있습니다.",예,"홈페이지 곳곳에서 ""CU""라는 브랜드명이 강조되고 있으며, BGF리테일이 CU 프랜차이즈를 운영하는 회사임을 알 수 있습니다. 검색 결과에서도 CU와 관련된 내용이 많이 등장합니다."
BYC,1460,봉제의복 제조업,"메리야스,란제리 제조,도매/건축공사/부동산 임대,분양,공급",김 대 환,http://home.byc.co.kr,서울특별시,BYC,"Open Contest - Mister BYC Beauty Pageant—Official 2025 BYC … - May 16, 2023 · This contest is brought to you by our BYC Sponsors (click to view & support them) Mister BYC Beauty Pageant Official 2025 BYC Mini-Contest Ends November 30th, 2025 This …
Open Contest - Miss BYC Beauty Pageant—Official 2025 BYC … - Nov 4, 2025 · Open Contest Official 2025 BYC Mini-Contests—Win One of 36 BYC 2026 Calendars!
Open Contest - Mister BYC Beauty Pageant—Official 2025 BYC … - Nov 4, 2025 · Open Contest Officia","BYC 홈페이지는 다양한 제품과 서비스를 제공하는 기업임을 나타냅니다. 봉제의복 제조를 주력으로 하며, 영어 페이지도 제공하여 글로벌 시장 진출을 고려하고 있음을 보여줍니다. 또한 BFC라는 별도의 사업 영역도 언급하며 다각화를 시도하고 있음을 암시합니다.",판단실패,"검색 결과에서 'Mister BYC Beauty Pageant', 'Miss BYC Beauty Pageant' 등 'BYC'라는 이름으로 널리 알려져 있으며, 홈페이지에서도 'BYC'라는 명칭이 주요하게 사용되고 있습니다."
CJ대한통운,120,도로 화물 운송업,"Contract Logistics, 포워딩, 항만하역, 해운, 택배국제특송, SCM Consulting","강신호,민영학(각자대표)",http://www.cjlogistics.com,서울특별시,CJ-8,"Forum list | CJ-8 - Oct 27, 2025 · CJ-8 History & Production Questions and topics related to the how CJ-8 Scramblers were originally equiped, production information, etc.
Holley Sniper EFI install on my 258 - CJ-8 - Jan 20, 2019 · I intended to take a bunch of pictures and make sure I document my experience installing the Sniper on my Scrambler. I probably did not get enough pictures or take enough …
No fuel, won't start without priming - CJ-8 - Sep 7, 2012 · OK, last week had a rough night and ","CJ Logistics는 도로 화물 운송, 포워딩, 항만하역, 해운, 택배, 국제특송, SCM 컨설팅 등 종합 물류 서비스를 제공하는 기업입니다. 고객에게 최적화된 물류 솔루션을 제공하며, 글로벌 네트워크를 통해 국제 물류 서비스도 제공하고 있습니다. 홈페이지에서는 기업 소개, 서비스 안내, 뉴스, 채용 정보 등을 확인할 수 있습니다.",아니오,"검색 결과에서 'CJ-8'이라는 이름이 반복적으로 등장하지만, 이는 Jeep Scrambler 모델을 지칭하는 약칭일 가능성이 높으며, CJ대한통운이라는 회사와 직접적인 관련은 없어 보입니다."
CJ씨푸드,11150,기타 식품 제조업,"수산물(어묵,맛살)가공품 도매,원양수산업,수출입","김정웅, 박태준(각자대표)",http://www.cjseafood.net,경기도,**CJ제일공산품** 또는 **CJ어묵**,"Forum list | CJ-8 - Oct 27, 2025 · CJ-8 History & Production Questions and topics related to the how CJ-8 Scramblers were originally equiped, production information, etc.
Holley Sniper EFI install on my 258 - CJ-8 - Jan 20, 2019 · I intended to take a bunch of pictures and make sure I document my experience installing the Sniper on my Scrambler. I probably did not get enough pictures or take enough botes, but here goes. To start off, I replaced a Holley 4bbl carb mounted on an Offenhauser intake","CJ씨푸드는 HACCP 인증을 받은 위생적인 환경에서 생산되는 수산 가공식품 전문 기업입니다. 엄선된 어종과 철저한 품질 관리를 통해 최고의 품질과 안전한 제품을 제공하며, 전국 유통망을 통해 소비자에게 신선한 제품을 공급하고 있습니다. CJ그룹의 계열사로서 다양한 사업을 영위하고 있습니다.",예,"검색 결과에서 'CJ-8'이라는 키워드가 반복적으로 등장하며, 이는 Jeep Scrambler 관련 커뮤니티에서 사용되는 명칭으로 보입니다. 홈페이지 내용에서 수산물 가공식품 전문 기업임을 강조하고 있으며, 어묵 제품을 다양하게 생산하고 있습니다. 이러한 점을 종합적으로 고려했을 때, 'CJ어묵' 또는 'CJ제일공산품'이 대중적으로 더 널리 알려진 이름일 가능성이 높습니다. (CJ제일공산품은 과거 CJ그룹의 주요 계열사였던 CJ제일공산품의 옛 이름입니다.)"
CJ제일제당,97950,기타 식품 제조업,"설탕,소맥분,조미식품,육가공식품(돈육,돼지비계,돼지식용설육),대두가공식품,사료,의약품,생활화학제품 제조,도매,무역/통신판매","손경식, 최은석 (각자 대표이사)",http://www.cj.co.kr,서울특별시,비비고,"CJ제일제당 (주) 2025년 기업정보 | 직원수, 매출액, 복리후생 등 - 사람인 - 설탕 , 소맥분 , 조미식품 , 육가공식품 ( 돈육 , 돼지비계 , 돼지식용설육 ), 대두가공식품 , 사료 , 의약품 , 생활화학제품 제조 , 도매 , 무역 / 통신판매 . 주소. 서울 중구 동호로 330.
CJ제일제당 (주) 기업정보 - 직원수, 근무환경, 복리후생 등 | 잡코리아 - 씨제이그룹 계열사. 설탕 제조업 . 설탕 , 소맥분 , 조미식품 , 육가공식품 ( 돈육 , 돼지비계 , 돼지식용설육 ), 대두가공식품 , 사료 , 의약품 , 생활화학제품 제조 , 도매 , 무역 / 통신판매 .
블라인드 | CJ제일제당 기업정보 - CJ제일제당은 종합 식품 제조업체로 설탕 , 소맥분 , 조미식품 , 육가공식품 , 대두가공, 식품 , 사료 , 의약품 , 생활화학제품 제조 , 도매 , 무역 등의 사업을 영위하고 있습니다.
CJ제일제당 - 나무위키 - 식품 사업, 바이오 사업, CJ Feed&Care.이를","CJ제일제당은 70년 이상 축적된 DNA를 바탕으로 건강, 즐거움, 편리를 창조하는 글로벌 식품·BIO 기업으로 도약하고 있습니다. 주요 사업으로는 식품, BIO, 사료 사업이 있으며, '비비고'를 비롯한 다양한 브랜드를 통해 세계 식탁에 K-Food를 제공하고 있습니다. 또한 지속가능한 경영을 추구하며, 소비자에게 건강하고 편리한 식생활을 제공하기 위해 노력하고 있습니다.",판단실패,"검색 결과와 홈페이지 내용에서 '비비고' 브랜드가 CJ제일제당의 핵심 브랜드임을 강조하고 있습니다. 특히 홈페이지에는 '비비고'를 소개하는 섹션이 있으며, 일본 시장 공략과 관련된 내용에서도 '비비고 만두'가 언급되는 등 대중적으로 널리 알려진 브랜드라는 것을 확인할 수 있습니다. 따라서 CJ제일제당을 대표하는 대중적인 이름으로 '비비고'가 적절하다고 판단됩니다."
DB,12030,"컴퓨터 프로그래밍, 시스템 통합 및 관리업","컴퓨터 프로그래밍, 시스템 통합 및 관리","문덕식,강운식 (각자 대표이사)",http://www.dbinc.co.kr,서울특별시,DB,"인공지능 영상분석을 통한 철강산업 제강공정 및 철스크랩 분류 시스템 ... - 차량 계수, 분류 관리 통합 시스템 . AI기반 통합 시스템 . CCTV 영상분석 객체인식.
[직업탐구] 컴퓨터프로그래밍 : 네이버 블로그 - 컴퓨터 프로그래밍 , 시스템 통합 및 관리업 . 컴퓨터 프로그래밍 업계에는 수행하는 업무에 따라 다양한 직업군이 존재한다.
허용업종 소개 | 외국인 고용 관리시스템 - 사업시설 관리 및 조경 서비스업.교육 서비스업. 62. 컴퓨터 프로그래밍 , 시스템 통합 및 관리업 .
시스템 통합 - 나무위키 - 애초에 비IT 기업들의 IT 개발 수요를 전담하기 위해 있는게 바로 시스템 통합 (SI) 회사들이다.
강실장의 여긴 어때 ? - J62 프로그래밍 시스템 통합 및 관리 (%) - О сервисе Прессе Авторские права Связаться с нами Авторам Рекламодателям...","현재 홈페이지 접속이 원활하지 않아 내용을 확인할 수 없습니다. (400 Bad Request 오류 발생) 일반적으로 DB는 IT 솔루션 및 서비스 제공 기업으로, 특히 인공지능 기반 영상 분석 및 시스템 통합 분야에 주력하고 있을 것으로 예상됩니다.",예,"검색 결과에서 'DB'라는 이름으로 언급되는 빈도가 높고, IT 솔루션 및 시스템 통합 관련 사업을 영위하는 회사 정보와 일치합니다."
DB손해보험,5830,보험업,"자동차보험,화재보험,해상보험,특종보험,장기보험","김정남, 정종표",http://www.idbins.com,서울특별시,DB손해보험,"What is the difference between *.sqlite and *.db file? - May 1, 2011 · 24 A .sqlite file is as the name implies a file that contains an SQLite database. The .db file extension is used by Oracle, Paradox and XoftSpySE databases. [1] As Christian noted …
How to grant a Managed Identity permissions to an Azure SQL … - Aug 28, 2023 · ALTER ROLE db_datawriter ADD MEMBER [MyManagedIdentity]; This is however failing because this requires that either the SQL Server or the GitHub action needs to …
sql - ",홈페이지 접속에 실패하여 내용을 확인할 수 없습니다. (HTTPConnectionPool 오류 발생),아니오,"홈페이지 접속 실패로 인해 홈페이지 내용을 바탕으로 'DB손해보험'이라는 이름이 대중적으로 통용되는지 검증할 수 없으며, 검색 결과는 SQL 데이터베이스 관련 내용으로 회사의 대중적인 이름과 관련이 없습니다."
DL,210,기초 화학물질 제조업,지주회사,김종현,http://www.dlholdings.co.kr,서울특별시,DL,"小科普：电影文件名中的WEB-DL、DDP、X265都是什么意思？ - Nov 20, 2023 · WEB-DL应该是现在最常见的，片源来自奈飞、迪士尼、HBO-MAX等海外流媒体平台，最高码率可达17Mb左右，一部2小时的电影体积在15GB以上，音轨则以杜比全景声为主（ddp内核）；
游戏王入坑是选择dl还是md? - 知乎 - DL的话不氪金则可能3个月以上才能集齐一套卡组，因为卡片只能抽，环境每个月都会大变一次，不氪金打排位会很痛苦，但又不至于不能玩。 游戏复杂度：差不多，DL并不比MD简单！
dl是什么意思? - 知乎 - May 17, 2020 · 下载：在互联网和计算机相关语境中，""DL""通常指代“download”，即下载，用于指示从网络上获取文件或数据的过程。 驾照：在特定的对话中，如“my DL”，可能指的是“driver license”，即驾驶证，意味着讨论者可能在提到自己或他人拥有驾照或需要获取驾照的情况。
"".dl_""是什么文件的后缀，该用什么软件打开？ - 知乎 - "".dl_""是什么文件的后缀，该用什么软件打开？ 用“.dll”查看软件打不开“.dl_","DL Holdings는 건설, 석유화학, 에너지/제조, 레저, 문화, 교육 등 다양한 사업 분야를 영위하는 지주회사입니다. DL Holdings는 DL이앤씨, DL케미칼, 글래드 호텔앤리조트 등 여러 계열사를 거느리고 있으며, 지속 가능한 성장을 위한 ESG 경영을 추구하고 있습니다. 홈페이지에는 회사 소개, 사업 정보, 투자 정보, IR 자료 등 다양한 정보를 제공합니다.",판단실패,"검색 결과에서 'DL'이 다운로드(download)의 약자로 사용되는 경우가 많고, 홈페이지에서도 회사 이름이 'DL Holdings'로 명시되어 있어 'DL'이라는 이름이 널리 사용되고 있음을 알 수 있습니다."
DL건설,1880,건물 건설업,"도로건설공사,토목공사,건축공사,조경공사/부동산 임대,매매",곽수윤,http://www.dlconstruction.co.kr,인천광역시,디엘씨(DLC) 또는 디엘앤씨(DL&C),"디엘이앤씨와 DL건설 관계(DL그룹 취업리뷰, 연봉정보) : 네이버 블로그 - 업종 종합건설업. 제품/사업. 종합건설( 도로건설공사 , 토목공사 , 건축공사 , 조경공사 )/ 부동산 임대 , 매매 . 설립일 1956.
경상도 부동산 임대 매매 가격 | TikTok - TikTok (틱톡) 에서 경상도 부동산 임대 매매 가격 관련 동영상을 찾아보세요.
뉴욕 부동산 , 아파트 임대 정보 - ニューヨーク賃貸アパートのJ.One... - 각 지역의 임대 부동산 보기.J.One 공인부동산의 서비스 내용. 주재원을 위한 고급맨션의 임대 , 매매 , 관리. 학생을 위한 저렴한 아파트, Room Share 소개. Office Space, 점포 등 상업부동산.
건설업 산업안전보건관리비 계상 기준(산출방법 등 예시) - 여기까지 건설업 산업안전보건관리비의 계상 기준과 관련하여 적용 대상, 계상 의무사항, 시기, 대상액 산정 방법과 산업안전보건관리비의 공사의 종류 적용과 계상방법에 대해 말씀드렸습니다.
","DL건설은 도로, 토목, 건축, 조경 공사 및 부동산 임대/매매 사업을 영위하는 종합건설 기업입니다. 특히 해외 부동산 임대 및 매매 사업에도 진출하여 글로벌 시장을 공략하고 있습니다. 홈페이지에는 기업 소개, 사업 현황, 투자 정보 등 다양한 정보를 제공하고 있습니다.",판단실패,"검색 결과에서 '디엘앤씨(DL&C)'라는 이름이 언급되지만, DL건설의 공식적인 대중적인 이름으로 널리 사용되고 있지는 않아 보이며, DL건설이라는 회사명 자체가 더 널리 알려져 있습니다."
DL이앤씨,375500,토목 건설업,토목 건설 사업,마창민,https://www.dlenc.co.kr/main.do,서울특별시,DL,"小科普：电影文件名中的WEB-DL、DDP、X265都是什么意思？ - Nov 20, 2023 · WEB-DL应该是现在最常见的，片源来自奈飞、迪士尼、HBO-MAX等海外流媒体平台，最高码率可达17Mb左右，一部2小时的电影体积在15GB以上，音轨则以杜比全景声为主（ddp内核）；
游戏王入坑是选择dl还是md? - 知乎 - DL的话不氪金则可能3个月以上才能集齐一套卡组，因为卡片只能抽，环境每个月都会大变一次，不氪金打排位会很痛苦，但又不至于不能玩。 游戏复杂度：差不多，DL并不比MD简单！
dl是什么意思? - 知乎 - May 17, 2020 · 下载：在互联网和计算机相关语境中，""DL""通常指代“download”，即下载，用于指示从网络上获取文件或数据的过程。 驾照：在特定的对话中，如“my DL”，可能指的是“driver license”，即驾驶证，意味着讨论者可能在提到自己或他人拥有驾照或需要获取驾照的情况。
"".dl_""是什么文件的后缀，该用什么软件打开？ - 知乎 - "".dl_""是什么文件的后缀，该用什么软件打开？ 用“.dll”查看软件打不开“.dl_","DL이앤씨는 건설, 토목, 플랜트 등 종합 건설 서비스를 제공하는 기업입니다. 80년의 역사를 바탕으로 대한민국 건설을 리드하며, 이제는 종합 설계시공(EPC) 및 토탈솔루션 사업자로 도약하고 있습니다. 또한, 기술 혁신과 지속 가능한 경영을 추구하며 사회적 책임을 다하는 기업을 지향합니다.",예,"검색 결과에서 ""DL""이 다운로드(download)의 약자로 사용되는 경우가 많고, 홈페이지에서도 회사 이름의 약자인 ""DL""을 주요하게 사용하고 있습니다. 또한, 회사 이름이 DL이앤씨이지만, 대중적으로는 ""DL""이라는 이름으로 더 많이 알려져 있을 가능성이 높습니다."
DN오토모티브,7340,일차전지 및 축전지 제조업,자동차용 밧데리,김상헌 김인환,http://www.dnautomotive.com,경상남도,** DN그룹,"DN오토모티브 - 위키백과, 우리 모두의 백과사전 - 주식회사 DN오토모티브는 자동차용 방진 제품과 배터리를 제조하는 업체이다. 역사. DN그룹의 모체인 동아타이어공업은 1971년, 부산광역시 안락동에 회사를 설립하여 타이어 사업을 개시하였다. 1992년, 방진 사업부를 설립하여 사업을 확장하였으며, 1999년에는 자동차용 축전지사업에 진출하였다.
블라인드 | DN오토모티브 기업정보 - DN오토모티브 회사소개. 홈페이지 dnautomotive.com. 업계 자동차/트레일러 제조업 . 본사 경상남도 양산시. 설립 1988.
DN오토모티브 채용 2025년 기업정보 | 캐치 - DN오토모티브 초봉 5150만원, 재무평가 상위 1%, DN오토모티브의 채용공고, 기업정보, 재무정보부터, 현직자리뷰, 면접후기까지 모두 캐치하세요. 축전지 제조업 .
납 축전지 개요 : 네이버 블로그 - SLI 축전지 (SLI battery) 자동차용 연축전지. SLI 는 시동(starting), 점등(light",** 홈페이지 접근에 실패하여 내용을 요약할 수 없습니다. (접속 오류 발생),** 예,"** 검색 결과에서 DN오토모티브는 DN그룹의 모태가 된 동아타이어공업에서 파생된 회사이며, 업계에서 DN그룹과 연관되어 널리 알려져 있을 가능성이 높습니다."
DSR,155660,1차 비철금속 제조업,합섬섬유로프,홍석빈,http://www.dsr.com,부산광역시,비케이리메칼,"비케이리메칼(주) 비철금속 정련 사원 모집 - 잡플로이 외국인 채용 - 비철금속 스크랩등을 전기분해 기계장치, 설비등을 통해 고순도금속으로 정련하는 작업임.3,541 백만. 업종. 기타 1 차 비철금속 제조업 .
[에코뷰 인터뷰] 업박스 운영사 리코는 어떤 회사인가요 ? - YouTube - О сервисе Прессе Авторские права Связаться с нами Авторам Рекламодателям...
이구산업 채용 핵심 기업분석 - 2025년 하반기 | 자소설닷컴 - 1 차 비철금속 제조업 .동합금계열 비철금속 소재인 Ingot, Billet, Slab를 제조 및 공급하는 기업. 중견기업.
중소기업특별세액 감면, 중요한 내용을 알려드릴게요 – 비즈넵 환급... - 비즈넵 케어의 세무파트너 지수회계법인은 어떤 회사인가요 ? 비즈넵 케어를 만든 지엔터프라이즈는 어떤 회사인가요 ?
[한국표준산업분류] 공장코드번호(업종분류번호) 종류 : 네이버 블로그 - - 광업 ",DSR 홈페이지의 내용은 확인되지 않았습니다. 제공된 정보에는 홈페이지 내용이 포함되어 있지 않습니다. 따라서 요약할 수 없습니다.,예,"검색 결과에서 ""비케이리메칼(주)""가 DSR과 동일한 업종(1차 비철금속 제조업)에 속하며, 비철금속 정련 작업을 하는 회사로 언급되고 있어, DSR이 대중적으로 비케이리메칼로 더 잘 알려져 있을 가능성이 높습니다."
DSR제강,69730,1차 철강 제조업,"와이어로프,각종 경강선,철선제품,PC강선,아연도 강연선 제조","홍하종, 홍석빈 (각자 대표이사)",http://www.dsrcorp.com,전라남도,DSR (Dynamic Super Resolution),"What is DSR? Do i want to use it? : r/nvidia - Reddit - Feb 27, 2019 · DSR stands for Dynamic Super Resolution. Basically what you're doing is running your games at a higher resolution than your monitor supports, then downscaling it to your monitors resolution.
DLDSR/DSR - What scaling resolution and smoothness should I ... -... - Jul 24, 2023 · I'm trying DLDSR/DSR for the first time and I wanted to get some advice on which resolution to choose and what smoothness as well. I see 1.78 and 2.25 a","DSR제강은 와이어로프, 경강선, 철선제품 등 다양한 철강 제품을 제조하는 기업입니다. 전라남도에 위치하고 있으며, 홍하종, 홍석빈 각자 대표이사가 이끌고 있습니다. 홈페이지에는 제품 정보, 회사 소개, 투자 정보 등을 확인할 수 있습니다.",판단실패,"검색 결과에서 'DSR'이 Nvidia의 기술에 대한 설명과 함께 반복적으로 등장하며, 기술적인 용어로서 널리 사용되고 있다는 점을 고려할 때, DSR제강이 기술 자체의 이름으로 더 널리 알려져 있을 가능성이 높습니다."
F&F,383220,봉제의복 제조업,"MLB, MLB KIDS, DISCOVERY 등 패션의류제품",김창수,http://www.fnf.co.kr,서울특별시,MLB,"MLB Global - Kids all. MLB Family. MLB with KARINA. SPORTY SUMMER.
MLB .com | The Official Site of Major League Baseball - MLB Players Association. Negro Leagues. MLB Play. Beat the Streak. Immaculate Grid.
California parents decapitated 2 kids , forced younger ones to look at... - A mother and father were convicted of decapitating two of their children and then making their two younger sons view their siblings’ headless bodies. Maurice Jewel Taylor Sr. and Natalie Sumi…
(주)에프앤에프 2025년 기업정보 | 직원","F&F는 MLB, MLB KIDS, DISCOVERY 등 다양한 패션 의류 브랜드를 소유 및 운영하는 기업입니다. 엔터테인먼트 사업 확장 및 글로벌 테니스 브랜드 'SERGIO TACCHINI' 인수를 통해 사업 영역을 넓혀가고 있으며, 지속적인 성장을 추구하고 있습니다.",예,"검색 결과에서 'MLB' 관련 키워드가 반복적으로 등장하며, F&F의 주요 브랜드로 강조되고 있어 대중적으로 더 잘 알려진 이름으로 판단됩니다."
GS건설,6360,건물 건설업,"토목공사,건축공사,주택공사,산업플랜트공사,리모델링공사,시설물유지관리공사/산업설비설계,감리 용역,수출입/에너지관리 진단,연구개발","허창수, 임병용(각자 대표이사)",http://www.gsconst.co.kr/,서울특별시,GS ENC (GS건설의 영문명),"The Goldman Sachs Group, Inc. (GS) - Yahoo Finance - Find the latest The Goldman Sachs Group, Inc. (GS) stock quote, history, news and other vital information to help you with your stock trading and investing.
The Goldman Sachs Group, Inc. (GS) - Find out all the key statistics for The Goldman Sachs Group, Inc. (GS), including valuation measures, fiscal year financial statistics, trading record, share statistics and more.
The Goldman Sachs Group, Inc. (GS) - Yahoo Finance - Discover historical p","GS건설 홈페이지는 국내 건설 시장을 선도하는 기업으로서, 플랜트, 건축·주택, 인프라, 레저 등 다양한 사업 영역을 포괄하며 기술 혁신과 지속 가능한 성장을 추구하고 있습니다. 또한, 사회공헌 활동과 윤리 경영을 강조하며 고객에게 최고 품질의 주거 공간과 서비스를 제공하기 위해 노력하고 있습니다.",예,"검색 결과에서 'GS'라는 이름으로 검색되고 있으며, 홈페이지에서도 'GS ENC'라는 영문명을 함께 사용하고 있는 것으로 보아, 'GS'가 대중적으로 더 널리 알려진 이름으로 추정됩니다. 또한, 검색 결과가 Goldman Sachs와 연관되어 나타나는 것은 GS건설이 해외에서 GS라는 이름으로 알려져 있음을 시사합니다."
