회사명,종목코드,업종,주요제품,대표자명,홈페이지,지역,대중적이름(추정),검색결과요약,홈페이지정보(요약),LLM_검증결과,LLM_검증근거
선진,136490,동물용 사료 및 조제식품 제조업,조제동물사료,이범권,https://www.sj.co.kr/,경기도,Tubi,"Tubi - Wikipedia - Tubi (stylized as tubı) is an American over-the-top ad-supported streaming television [2] service owned by Fox Corporation since 2020. [3][4] The service was launched on April 1, 2014, and is based in San Francisco, California. [5][6] In 2023, Tubi , Credible Labs, and a few other Fox digital assets were placed into a new division known as the ...
5 Must-Watch Tubi Movies to Stream (October 2025): ‘Girls ... - Oct 2, 2025 · Everyone knows about Netflix and Hulu, but many of us","(주)선진은 동물용 사료 및 조제식품 제조업체입니다. 홈페이지에는 회사 정보가 간략하게 소개되어 있으며, 사업 분야 및 연락처 등의 정보를 확인할 수 있습니다. 현재 홈페이지는 활성화되어 있지 않아 최신 정보는 확인하기 어렵습니다.",아니오,"검색 결과에서 'Tubi'는 Fox Corporation 소유의 스트리밍 서비스이며, 회사 정보에서 선진은 동물용 사료 제조업체이므로 직접적인 연관성이 없습니다."
세방,4360,도로 화물 운송업,"도로운송,항만하역,창고,지게차 임대",최종일,http://www.sebang.com,부산광역시,세방,"세방 - SEBANG - 세방 (주) 홈페이지를 방문해 주셔서 감사합니다. 세방은 1965년 항만하역 사업에 첫 발을 내디딘 후 지난 반세기 동안 전국 주요 항만 및 물류 거점에 경쟁력 있는 물류 네트워크를 구축, 명실상부한 대한민국 대표 종합물류 기업으로 성장했습니다.
SEBANG - 세방 - 세방 주식회사 (06212) 서울특별시 강남구 선릉로 433 (역삼동, 세방빌딩) | 사업자등록번호 : 617-81-03842 Copyright (c) SEBANG CO., LTD ALL RIGHT RESERVED Family Site
세방 - SEBANG - Business Area Customer Center Copyright(c) SEBANG CO., LTD ALL RIGHT RESERVED Family Site세방전지세방산업세방익스프레스세방이의순재단
세방 - SEBANG - Group Company IntroductionGroup Company Introduction
세방 - SEBA","세방은 1965년 항만하역 사업을 시작으로 종합물류 기업으로 성장했으며, 도로 운송, 항만 하역, 창고, 지게차 임대 등 다양한 물류 서비스를 제공합니다. 최근에는 콜드체인 사업을 강화하고 있으며, ESG 경영을 통해 지속 가능한 성장을 추구하고 있습니다. 또한, 3PL, 헤비 카고, 3구역 물류 서비스 등 다양한 전문 분야를 제공하며 고객 맞춤형 물류 솔루션을 제공합니다.",판단실패,"검색 결과에서 ""세방""이라는 이름이 명실상부한 대한민국 대표 종합물류 기업으로 널리 알려져 있음을 확인할 수 있습니다. 홈페이지 내용 또한 '세방'이라는 이름으로 사업을 소개하고 있으며, 다양한 물류 서비스와 전문 분야를 제공하고 있음을 강조하고 있습니다. 따라서, 회사 정보와 검색, 홈페이지 내용을 종합적으로 고려했을 때 '세방'이 대중적인 이름으로 적절하다고 판단됩니다."
세방전지,4490,일차전지 및 축전지 제조업,"자동차용 및 산업용 축전지(연축전지) 제조,판매",대표이사 김대웅,http://www.gbattery.com,서울특별시,세방,"세방전지 - 위키백과, 우리 모두의 백과사전 - 세방전지주식회사는 1952년 9월에 자동차용 및 산업용 축전지의 제조 및 판매를 목적으로 설립된 기업이다. 1987년 11월 발행주식을 한국증권선물거래소가 개설하는 유가증권시장에 상장한 주권상장 법인이다. 축전지의 제조 , 판매를 주요사업으로 하고 있다.
세방전지 (주) 2025년 기업정보 - 직원수, 근무환경, 복리후생 등 | 잡코리아 - 축전지 제조업 . 자동차용 , 산업용 축전지 ( 연축전지 ) 제조 , 판매 . 4대보험. 국민연금, 건강보험, 고용보험, 산재보험.
블라인드 | 세방전지 기업정보 - 세방전지 회사소개. 홈페이지 www.gbattery.com. 업계 기계/전기장비 제조업 . 본사 서울특별시 강남구. 설립 1952.
세방전지 - 나무위키 - 축전지 제조업 . 대표자. 박정희.1952년 9월에 자동차용 및 산업용 축전지의 제조 및 판매를 목적으로 설립되었다. 1987년 11월 발행주식을 한국증권거래소가 개설한 유가증권시","세방전지는 70년 동안 연축전지 분야 1위를 지키며, 친환경 에너지 기업으로 발전하고 있습니다. 고객에게 최고의 품질로 감동을 주고자 하며, 사회공헌 활동을 통해 더 나은 세상을 만들고자 노력하고 있습니다. 또한, 다양한 사업 분야를 아우르는 세방그룹의 일원으로서 지속 가능한 성장을 추구합니다.",판단실패,"검색 결과 및 홈페이지에서 '세방'이라는 이름이 지속적으로 사용되고 있으며, 특히 '대한민국 연축전지 분야의 1위'라는 표현과 함께 사용되는 빈도가 높아 대중적으로 더 잘 알려진 이름으로 판단됩니다. 또한, 세방그룹의 일원으로서 다양한 사업을 영위하고 있음을 고려할 때, '세방'이라는 브랜드 인지도가 높을 것으로 예상됩니다."
세아제강,306200,1차 철강 제조업,강관,"이휘령, 김석일",http://www.seahsteel.co.kr,서울특별시,세아테크,"TEC - Jul 10, 2023 · Main objective of the Telecentre Entrepreneur Course (TEC) is to accelerate the growth and success of entrepreneurs through various services that could include physical space, capital, coaching, …
TEC Registration 2025 - Fee, Portal Login @ cscentrepreneur.in - In this article, we are providing detailed information about registering for the TEC Exam 2025, including the required document list, registration fees, etc. The TEC registration process is designed to be user …
TEC R","세아제강은 강관 제조를 주력으로 하며, 석유 및 가스, 수소 운송, 건설, 조선, LNG, 해양 플랜트 등 다양한 산업 분야에 제품을 공급합니다. R&D 투자와 기술 개발을 통해 경쟁력을 강화하고 있으며, 지속적인 성장을 위한 노력을 기울이고 있습니다.",예,"검색 결과에서 ""TEC""라는 이름이 반복적으로 등장하며, ""Telecentre Entrepreneur Course""의 약자인 것으로 보아, 세아제강의 기술 또는 서비스와 관련된 이름일 가능성이 높습니다. 또한 홈페이지에서도 'APPLICATION' 섹션에서 TEC 관련 기술이 언급되고 있어, '세아테크'라는 이름이 회사 활동과 관련되어 사용될 가능성이 높다고 판단됩니다."
세우글로벌,13000,기타 전문 도매업,"화공약품.엔지니어링 플라스틱,페놀계제품,석유화학제품 판매/철재가구,사무목재가구 제조/교육사업",안백순,http://www.sewoo21.co.kr,인천광역시,세우글로벌,"(주) 세우글로벌 2025년 기업정보 | 직원수, 매출액, 복리후생 등 - 사람인 - 화공약품 . 엔지니어링 플라스틱 , 페놀계제품 , 석유화학제품 판매 / 철재가구 , 사무목재가구 제조 / 교육사업 . 주소. 인천 미추홀구 염전로261번길 26-48.
폐플라스틱 관련주, 대장주 TOP10 | 플라스틱 재활용 - KOOCBLOG - 세우글로벌은 엔지니어링 플라스틱 , 고기능수지, 범용 플라스틱 등을 공급하는 전문 유통업체로, 폐플라스틱 재활용 테마와 관련해 높은 관심을 받고 있습니다.
엔지니어링 플라스틱 막대, 가공 제품의 플레이트, 전문 제조 업체... - HiShiRon는 긴 산업 주식 회사는 엔지니어링 플라스틱 , 플라스틱 , PP 플라스틱 , PVC 플라스틱 , 나일론 및 PI 플라스틱의 생산을 전문으로, 엔지니어링 플라스틱 반제품의 전문 제조 업체입니다.
사출 성형 재료 | 플라스틱 제품군의 주요 종류 | 첫 번째 몰드 - 엔지니어링 플라스틱 (ABS, PC, 나일론, PO","(주)세우글로벌은 화공약품, 엔지니어링 플라스틱, 철재/사무목재 가구 제조 및 판매, 교육 사업을 영위하는 기업입니다. 특히 엔지니어링 플라스틱 유통 분야에서 높은 관심을 받고 있으며, 다양한 플라스틱 원료를 공급하고 있습니다. 인천광역시 미추홀구에 위치하고 있습니다.",판단실패,"검색 결과에서 '세우글로벌'이라는 이름으로 지속적으로 언급되고 있으며, 엔지니어링 플라스틱 유통 및 관련 사업에 대한 높은 관심도를 확인할 수 있습니다."
세원정공,21820,자동차 신품 부품 제조업,"자동차부품(차체류,램프류) 제조",장제상,http://www.se-won.co.kr,대구광역시,세원,"Mazda CX-30 - Reddit - I honestly suck at cars, as per my profile I think you can probably see that be been chopping and changing between the CX-30 G25 Touring (FWD) and the Crosstrek 2.0R Series, both in the 2024 model. Model of interest: CX-30 G25 Touring (Ceramic Metal Colour). I love the luxurious feel of the CX-30, it’s an insane vehicle. The feel is amazing and the driving experience is awesome. That engine ...
Firmware 74.00.310A Released - Your Help is Needed! : r/mazda -... - Nov 26, 20","세원정공은 자동차 신품 부품 제조업체로, 특히 자동차 차체 및 램프류 부품 생산에 주력하고 있습니다. CEO의 리더십 아래 기술 개발과 품질 향상에 힘쓰며, 다양한 언어로 서비스를 제공하고 있습니다. 고객 만족을 최우선으로 생각하며, 지속적인 혁신을 통해 업계를 선도하고자 노력하고 있습니다.",예,"검색 결과에서 Mazda CX-30, Mazda 6 등 Mazda 차량 관련 내용이 반복적으로 등장하며, 이는 세원정공이 Mazda 자동차 부품을 주로 생산하는 업체임을 시사합니다. 또한 홈페이지에서도 '세원'이라는 이름이 반복적으로 사용되며, 이는 대중적으로 '세원'이라는 이름으로 더 잘 알려져 있음을 뒷받침합니다."
세이브존I&C,67830,종합 소매업,"대형할인점(백화점)/부동산 임대/주차장,문화센터 운영","김현동, 이상준",http://www.savezone.co.kr,서울특별시,세이브존,"2년 만에 영업익 반토막…' 부동산 부자' 세이브존, 본업서 휘청 - 조선비즈 - 그럼에도 불구하고 세이브존I & C 주가가 하락한 것을 두고 업계는 장기 성장 전략 부재 때문으로 분석한다. 지난 2014년 말 8000원을 넘었던 주가는 이날 현재 3000원대 초반에서 거래되고 있다.
국민연금공단, 현대백화점 주식 보유 현황 보고 - 현대백화점은 2002년 11월 25일 코스피에 상장된 종합 소매업체다.#현대백화점 # 종합 소매업 #코스피 #임원ㆍ주요주주특정증권등소유상황보고서 #지배구조·경영권 #AI공시DB.
임대 부동산 계산기 - 임대 부동산 계산기 사용 방법. 우리의 임대 부동산 가치 계산기에는 정보가 제공되는 네 개의 주요 영역이 있습니다—구매, 운영 비용, 수입, 판매 가격.
부동산 가치만 1조…유통주인지 건설주인지 헷갈리는 이곳 | 한국경제 - “ 부동산 가치만 최소 1조원”. 유통업계에선 세이브존I &C가 각 지역 ‘알짜배기’ 땅에 6개 점포를 모두 직접 소유하고 있는 게","세이브존은 대형 할인점(백화점) 운영, 부동산 임대, 주차장 및 문화센터 운영 등을 주요 사업으로 하는 기업입니다. 특히, 각 지역의 '알짜배기' 땅에 6개의 점포를 직접 소유하고 있어 부동산 가치가 높은 것으로 평가받고 있습니다. 홈페이지에서는 사업 소개 및 관련 정보를 제공하고 있습니다.",판단실패,"검색 결과에서 '세이브존'이라는 이름으로 회사가 언급되고 있으며, 부동산 가치와 관련된 기사에서 세이브존I&C의 부동산 사업이 중요한 요소로 부각되는 점을 고려할 때, '세이브존'이라는 이름이 대중적으로 더 널리 알려져 있을 가능성이 높습니다."
셀트리온,68270,기초 의약물질 및 생물학적 제제 제조업,"램시마, 트룩시마, 허쥬마",기우성,http://www.celltrion.com,인천광역시,램시마,"셀트리온 - 나무위키 - 생물학적 제제 제조업 . 시가총액. 셀트리온 “ 램시마 , 유럽 의약품청서 ‘허가의견’ 획득"".
생물학적 제제 관리 및 수송 규제에 대해 바로 알기 - 윌로그 블로그 - 여러분은 생물학적 제제 유통 규제 강화에 어떻게 대응하고 있나요? 지난 1월 윌로그가 제약 산업 종사자 대상으로 ‘ 생물학적 제제 관리 및 수송 규제에 대한 인식조사’를 하여 개정안에 대한 인지와 어떻게 대응하고 있는지 확인할 수 있었습니다.
[공시] 셀트리온 , 2000억 규모 바이오시밀러 공급계약 체결 | 한스경제 - 셀트리온 "" 램시마 ·램시마SC, 제형 달라도 유효성 차이 없다"".# 셀트리온 #바이오시밀러 #의약품상품 # 램시마 # 트룩시마 # 허쥬마 #램시마SC.
“셀트리온을 ‘한국의 머크’로 만들겠다” < 경제 < 기사본문 - 시사저널 - 류머티스관절염 치료제 레미케이드의 바이오시밀러인 ‘ 램시마 ’ 개발은 언제 시작했나. 2003년부터 바이오시밀러 연구·개발(R&D)에 착수했다.","셀트리온은 최근 엘리 릴리의 미국 제조 시설을 인수하는 계약을 체결했으며, 관련 규제 절차를 완료하여 연내 인수 완료를 예상합니다. 이번 인수를 통해 관세 위험 제거, 지리적 불확실성 완화, 미국 내 CMO 기회 확대를 기대하며, 인수 후 통합을 가속화하고 현지 직원 지원을 강화할 계획입니다.",판단실패,"검색 결과에서 램시마가 셀트리온과 함께 지속적으로 언급되며, 관련 기사 제목이나 내용에서도 주요하게 등장하는 것을 확인할 수 있습니다. 이는 셀트리온이라는 회사 자체보다는 램시마라는 제품이 대중적으로 더 널리 알려져 있음을 시사합니다."
솔루엠,248070,전자부품 제조업,"POWER, 3in1 Board, ESL 등",전성호,http://www.solu-m.com,경기도,** 솔루엠 (Solu-M),"Textbooks PDF (I-XII) - NCERT - The service covers textbooks of all subjects published by NCERT for classes I to XII in Hindi, English and Urdu. The Entire book or individual chapters can be downloaded provided the …
NCERT - Model Question Papers Books Indent Form School Kits Exemplar Problems Laboratory Manuals 50 years of NCERT Results Framework Document Trilingual Dictionaries Adult Education …
NCERT - एनसीईआरटी, श्री अरबिंदो मार्ग, नई दिल्ली-110016 dceta [dot]ncert [at]nic [dot]in
NCERT - 2 ",** 홈페이지 접속에 실패하여 내용을 확인할 수 없습니다. 오류 메시지는 서버 연결 거부 오류를 나타냅니다.,** 아니오,"** 검색 결과가 NCERT라는 교육 기관과 관련된 내용으로 가득 차 있으며, 회사명인 '솔루엠'과는 전혀 관련이 없습니다. 따라서 '솔루엠'이라는 이름이 대중적으로 알려져 있다고 보기 어렵습니다."
송원산업,4430,기타 화학제품 제조업,"폴리머첨가제(PVC안정제,산화방지제),폴리우레탄수지,프라스틱첨가제 제조",김충식 대표이사,http://www.songwon.com,울산광역시,SONGWON,"TikTok - Make Your Day - TikTok - trends start here. On a device or on the web, viewers can watch and discover millions of personalized short videos. Download the app to get started.
TikTok - Ứng dụng trên Google Play - Được thiết kế cho thế hệ người trẻ yêu thích âm nhạc và sáng tạo, TikTok cho phép người dùng dễ dàng và nhanh chóng tạo các video ngắn độc đáo để chia sẻ với bạn bè và giới trẻ trên …
Ứng dụng TikTok - App Store - Tải TikTok của TikTok Ltd. về trên App Store. Xem ảnh chụp màn hìn","SONGWON은 전 세계적인 화학 회사로, 폴리머 안정제, 연료 및 윤활유 첨가제, 특수 화학 물질 등 다양한 제품을 제공합니다. 고객의 요구에 맞는 맞춤형 솔루션을 제공하며, 자동차, 건설, 포장, 윤활유, 전기/전자 등 다양한 산업 분야에 제품을 공급하고 있습니다. 특히 폴리머 안정제 분야에서 세계 2위의 제조업체이자 공급업체입니다.",판단실패,"검색 결과에서 TikTok 관련 내용이 전혀 없으며, 홈페이지 내용에서 'SONGWON'이라는 이름이 회사명으로 명시되어 있고, 주요 사업 분야 및 제품 소개를 통해 회사의 핵심적인 역할을 강조하고 있어, 'SONGWON'이 대중적으로 더 널리 알려진 이름이라고 판단됩니다."
수산중공업,17550,특수 목적용 기계 제조업,"유압브레이커,트럭크레인,플라즈마 파암장비,특장차,산업기계,건설기계 제조,도매","정석현, 신수근(각자 대표이사)",http://www.soosanheavy.com,경기도,BandLab,"BandLab - Wikipedia - BandLab is an entry level music production app to create songs in various genres. [6] Free Audio & Vocal Preset effects, allowing members to change the sounds of vocals & other audio track …
BandLab - Make Music Online - BandLab is the next-generation music creation platform used by millions around the world to make and share their music. Sign up today (it’s free!) and discover a whole new world of …
BandLab – Music Making Studio - Apps on Google Play - The free BandLab app","홈페이지 접속 시 JavaScript 및 쿠키 활성화를 요구하며, 현재 정상적인 내용을 표시하지 않고 있습니다. 검색 결과에 따르면 BandLab은 음악 제작 플랫폼으로, 사용자들이 음악을 만들고 공유하며 협업할 수 있는 환경을 제공합니다.",아니오,"수산중공업은 특수 목적용 기계 제조업체이며, 검색 결과와 홈페이지 내용은 음악 제작 플랫폼 BandLab에 대한 정보이므로, 두 회사는 관련이 없어 보입니다."
시디즈,134790,가구 제조업,의자,강성문,http://www.sidiz.com,경기도,시디즈(SIDIZ),"시디즈 - 나무위키 - 금속 가구 제조업 . 기업 규모.시디즈의 플래그십 사무용 의자 T90HLDA 모델.
시디즈 의자 중고거래 검색결과 | 당근 - 지금 서울특별시 서초구 서초4동에서 거래되고 있는 시디즈 의자 매물을 구경해보세요.
시디즈 WORK: 사무용 의자 , 컴퓨터 의자 , 책상 의자 – SIDIZ - EASY REPAIR. 나에게 맞는 의자 찾기. 시디즈 더 프로그레시브 세일. 시디즈 X 토트넘 파트너십 체결.
티오 단독 책상세트+ 시디즈 링고의자 DIY | 한샘몰 - ACC. 소재. 의자 . 품질보증. 라인업. 기본정보. 티오 단독 책상세트+. 시디즈 링고의자 DIY.안심하고 사용하는 한샘 가구 .
이게 진짜 게이밍 의자 ! ' 시디즈 GC PRO' | 인벤 - 시디즈 GC 게이밍 의자 확인하러 가기. 시디즈 인벤 바로가기.","시디즈 공식 홈페이지는 다양한 종류의 의자(사무용, 게이밍, 성장용 등)를 판매하며, 고객에게 맞는 의자를 찾을 수 있도록 가이드 및 추천 서비스를 제공합니다. 또한, 토트넘 핫스퍼와의 파트너십, 품질 보증, 리퍼럴 제도, 그리고 '앉는다는 것의 진화'라는 브랜드 캠페인을 강조하고 있습니다.",예,"회사명과 동일하게 '시디즈'라는 이름이 검색 결과, 홈페이지 내용 전반에 걸쳐 일관되게 사용되고 있으며, 제품명으로도 널리 사용되고 있습니다. 나무위키 검색 결과에서도 '시디즈'라는 이름으로 명확히 알려져 있습니다."
신대양제지,16590,"골판지, 종이 상자 및 종이용기 제조업","골판지용 골심지,라이너지 제조,수출입","권혁홍, 이상천(각자 대표이사)",http://www.dygroup.co.kr,경기도,대양그룹,"Cricbuzz - India vs South Africa | Live Cricket Score, Schedule, … - Get Live Cricket Scores, Scorecard, Schedules of International and Domestic cricket matches along with Latest News, Videos and ICC Cricket Rankings of Players on Cricbuzz.
Asia Cup 2025 | Live Cricket Score | Scorecard - Cricbuzz - Get Live Cricket Scores, Ball by Ball Commentary, Scorecard Updates, Match Facts & related News of all the International & Domestic Cricket Matches across the globe.
Live Cricket Score | Scorecard | ","대양그룹은 1970년 골판지원지 생산으로 시작하여 환경을 생각하는 포장재 제조업체로 성장했습니다. 골판지, 상자, 산업용지 생산을 주력으로 하며, 관계사 및 협력사와의 협력을 통해 지속적인 성장을 추구하고 있습니다. 또한, 투명한 경영과 윤리경영을 강조하며, 고객 만족을 최우선으로 하는 기업입니다.",예,"검색 결과에서 'Cricbuzz'라는 키워드가 반복적으로 등장하며, 이는 골프와는 전혀 관련 없는 크리켓(Cricket) 스포츠 관련 웹사이트입니다. 회사 정보에서 신대양제지가 골판지, 종이 상자 및 종이용기 제조업임을 알 수 있으며, 이는 포장재와 관련된 산업입니다. 홈페이지 내용 또한 포장재 제조업체임을 나타냅니다. 따라서 검색 결과와 회사 정보의 불일치로 인해 '대양그룹'이라는 이름이 더 널리 알려져 있을 가능성이 높습니다."
신라교역,4970,어로 어업,"원양어업(참치,명태,휠레트,연육,명란,새우),어획물 판매/직물 수출",김호운,http://www.sla.co.kr,서울특별시,신라,"Free Online Document Editing with Microsoft Word | Microsoft 365 - Use Microsoft Word for online document editing with AI-powered suggestions from Copilot for grammar, style, and clarity. Write, edit, and collaborate anywhere.
Create and edit documents for free | Microsoft Word for the Web - Write, edit, and collaborate on documents with Microsoft Word online. Free and seamless access from any device.
Microsoft Word - Download - Dec 2, 2024 · Once you download Microsoft Word for Windows, you can","신라교역은 원양어업(참치, 명태 등)을 주력으로 하는 회사이며, 어획물 판매, 직물 수출, 식당 운영 등 다양한 사업을 영위하고 있습니다. 지속가능한 경영을 추구하며, 사회적 책임을 다하기 위해 노력하고 있으며, 서울에 본사를 두고 있습니다.",판단실패,"홈페이지에 'SILLA'라는 명칭이 반복적으로 사용되고 있으며, 회사 정보에 '신라교역'이라는 명칭이 사용되는 점을 종합적으로 고려했을 때, '신라'라는 이름이 대중적으로 더 널리 알려져 있을 가능성이 높다고 판단됩니다."
신성통상,5390,기타 전문 도매업,"의류,악세사리(모자,벨트,가방) 도매/의류 제조",대표이사 염태순,http://www.ssts.co.kr,서울특별시,** Instagram,"Instagram App - App Store - Download Instagram by Instagram, Inc. on the App Store. See screenshots, ratings and reviews, user tips, and more games like Instagram.
Instagram - App Store - Download Instagram by Instagram, Inc. on the App Store. See screenshots, ratings and reviews, user tips and more games like Instagram.
Instagram App - App Store - Download Instagram by Instagram, Inc. on the App Store. See screenshots, ratings and reviews, user tips and more games like Instagram.
Instagramアプリ -",** 현재 홈페이지 접속 시 오류(400 Bad Request)가 발생하여 내용을 확인할 수 없습니다. 따라서 홈페이지 요약은 불가능합니다.,** 아니오,"** 검색 결과가 Instagram 관련 내용만 반복적으로 나타나고 있으며, 회사 정보(의류, 악세사리 도매/제조)와는 직접적인 관련이 없어 'Instagram'이 신성통상의 대중적인 이름이라고 보기 어렵습니다."
