회사명,종목코드,업종,주요제품,대표자명,홈페이지,지역,대중적이름(추정),검색결과요약,홈페이지정보(요약),LLM_검증결과,LLM_검증근거
진양산업,3780,플라스틱제품 제조업,"합성수지,폴리우레탄스폰지 제조,도매,수출입",조영태,http://www.cyc1963.com,경상남도,진양,"通販・テレビショッピングのショップチャンネル - 24時間放送、テレビショッピングでお馴染みのショップチャンネルの通販サイト。 テレビ通販と連動して世界中から集めた厳選商品を皆様にお届けします。
ご利用ガイド - 通販・テレビショッピングのショップチャンネル - 24時間生放送、テレビショッピングでお馴染みのショップチャンネルの通販サイト。 テレビ通販と連動して世界中から集めた厳選商品を皆様にお届けします。
ブランド一覧 - 通販・テレビショッピングのショップチャンネル - ブランド一覧 - 通販・テレビショッピングのショップチャンネル
通販・テレビショッピングのショップチャンネル - 日本最大のショッピング専門チャンネル、ショップチャンネルのオンラインショッピングサイトへようこそ！ テレビ放送と連動してご紹介する商品、ネット独自のサービス・商品が生みだすショッピングを、ぜひお楽しみください。
番組表 - 通販・テレビショッピングのショップチャンネル - ショップチャンネルの番組表はこちら。 今日1日の番組・商品情報はもちろん、明日以降の放送予定をご案内します。","진양산업은 친환경, 고품질 폴리우레탄 폼 제품을 생산하며, 사람과 자연을 먼저 생각하는 기업입니다. 다양한 설비를 구축하여 자동차 부속품, 매트리스 등 다양한 제품을 생산하고 있으며, PCR 기반 재활용 연구 및 독일 A사와의 협업을 통해 재생 원료 활용을 극대화하고 있습니다.",예,"검색 결과에서 '쇼핑 채널'과 연관되어 진양산업 제품이 소개되고 있으며, 홈페이지에서도 제품 소개 및 기술 정보가 주를 이루는 점을 고려할 때, '진양'이라는 이름으로 더 널리 알려져 있을 가능성이 높습니다. 또한, 홈페이지의 제품 소개에서 '진양'이라는 이름이 직접적으로 언급되지는 않지만, 제품의 특징과 용도를 설명하며 간접적으로 브랜드 인지도를 높이고 있습니다."
진양폴리우레탄,10640,플라스틱제품 제조업,"폴리우레탄,폴리우레탄스폰지 제조,판매",조영태,http://www.chinyangpoly.kr,경기도,진양제약,"[소재탐구] 폴리우레탄 (PU) 알아보기 | 바로발주 - 지속 가능한 개발 폴리우레탄 산업은 지속 가능한 소재 개발과 제조 공정 개선을 통해 환경 영향을 최소화하려는 노력을 지속하고 있습니다.
[기고] 중(重)희토류 없인 한국 제조업 위기 빠질 수 있다 | 에너지신문 - 지난해 10월, 현대차그룹은 미래에 전체 생산 제품의 30%를 도심형항공모빌리티(Urban Air Mobility, UAM)가 차지할 것이라고 밝혔다. 도심형 항공모빌리티는 수직이착륙이 가능한 개인용 비행체, 일명 ‘드론’의 개발부터 제조 , 판매 , 유지...
오세훈 관련주 정리 TOP 10(대장주, 테마주, 수혜주) | 주식스토커 - 진양제약은 어떤 회사인가요 ? 동사는 1971년 의약품의 제조 , 판매 등을 주 영업목적으로 설립되었으며, 2000년 코스닥시장에 상장함.
(주) 대흥산업 2025년 기업정보 | 직원수, 근무환경, 복리후생 등 - 사람인 - 벽 및 바닥 피복용 플라스틱제품 제조업 . 40 관심기업.","진양폴리우레탄은 고품질 폴리우레탄 폼을 제조하는 기업으로, 지속적인 기술 혁신과 고객 중심 서비스를 통해 글로벌 시장에서 경쟁력을 확보하고 있습니다. 70년 이상의 역사를 바탕으로 다양한 제품과 솔루션을 제공하며, 고객 만족을 최우선으로 생각하며 끊임없이 발전하고 있습니다.",아니오,"검색 결과에서 '진양제약'이라는 이름이 등장하며, 동사가 1971년 의약품 제조 및 판매를 주 영업목적으로 설립되었고 2000년 코스닥 시장에 상장했다는 내용이 있습니다. 이는 현재의 진양폴리우레탄과는 다른 회사임을 나타냅니다. 따라서 현재의 주요 사업인 폴리우레탄 제조 및 판매를 통해 더 널리 알려진 이름은 '진양폴리우레탄'이라고 판단됩니다."
진흥기업,2780,토목 건설업,"아파트건설,토목공사,건축공사,국내도급공사",박상신,http://www.chinhung.co.kr,인천광역시,진흥,"shopify 独立站 .com 域名与 .shop 域名区别和影响大吗？ - 知乎 - Feb 22, 2022 · shopify 独立站 .com 域名与 .shop 域名区别和影响大吗？ 目前是一个.shop的域名，因为之前注册域名的时候.com不可用了，然后现在公司说最好是搞一个.com的，然后我去查了一下这个.com的域名也是要做s… 显示全部 关注者 17
store和shop的区别？_百度知道 - Oct 24, 2023 · store和shop的区别： 英国多用shop, 表示商店, 店铺之意。 主要看搭配: a sport shop, a fruit shop; a grocery store, a furniture store. 在美国英语中store更表示'小店'的意思, 而英国表示'百货商店'. 美国英语中百货商店则是Department Store. store 1、Bombs were planted in stores in Manchester and Blackpool. 炸弹被安放在曼彻斯特和 ...
store和shop有什么区别？_百度知道","진흥기업은 인천광역시를 기반으로 아파트 건설, 토목 공사, 건축 공사 등 토목 건설업을 영위하는 기업입니다. 홈페이지는 기업 소개 및 사업 분야를 간략하게 설명하고 있습니다. 현재 홈페이지는 특별한 내용이 보이지 않습니다.",예,"검색 결과에서 '진흥'이라는 이름으로 언급되는 빈도가 높고, 회사 정보에 제시된 회사명과 일치하며, 토목 건설업을 하는 기업의 특성상 일반적인 명칭으로 사용될 가능성이 높습니다."
카카오뱅크,323410,은행 및 저축기관,은행 및 금융서비스,윤호영,https://m.kakaobank.com/,경기도,카카오뱅크,"알고나면 정말 편할걸요? 카카오뱅크 오픈뱅킹 사용법 - 이제 다른 은행앱은 Bye~ 카카오뱅크 하나로 관리하세요.
카카오뱅크 라우팅번호 만들어서 송금받기 | EXCEL Community - 1. 카카오뱅크 라우팅번호 가입 시작하기3. 은행 및 계좌번호 입력
IPO공모 > 카카오뱅크 공모주청약 일정, 공모주분석 - 비상장... - 은행 및 저축기관 . 대표자. 윤호영.접수일자. 보고서명. 2021/07/22. [ 카카오뱅크 ][발행조건확정]증권신고서(지분증권).
2024 카카오뱅크 중신용대출 한도 및 가입대상 알아보기 https... - 질문1: 카카오뱅크 중신용대출은 어떤 사람에게 적합한가요? 답변1: 중신용대출은 연소득 2,000만원 이상이고 재직 기간이 1년 이상인 근로소득자에게 적합합니다.
부속서 1나 서비스무역에 관한 일반협정(WTO국문협정문) 상세보기... - 가. 금융서비스는 회원국의 금융서비스 공급자에 의해 제공되는 금융적 성질을 가지는 모든 서비스이다. 금융서비스는 모","카카오뱅크 홈페이지는 모바일뱅킹 서비스 이용약관, 전자금융거래약관, 개인정보처리방침 등 서비스 이용에 필요한 정보와 법적 고지 사항을 제공합니다. 윤호영 대표이사 및 사업자 번호 정보와 함께 웹 트러스트 인증 정보를 확인할 수 있습니다. PC 버전 웹사이트로 이동할 수 있는 링크도 제공합니다.",판단실패,"검색 결과에서 '카카오뱅크'라는 이름으로 언급되는 빈도가 매우 높고, 은행 및 금융 서비스 제공업체로서의 역할을 수행하고 있다는 점을 고려할 때, '카카오뱅크'가 대중적으로 더 잘 알려진 이름이라고 판단됩니다."
케이씨,29460,"측정, 시험, 항해, 제어 및 기타 정밀기기 제조업; 광학기기 제외",가스/Chemical 공급 장치 등 제조 및 판매,"고상걸, 권홍빈(각자대표이사)",http://www.kct.co.kr,경기도,KC,"제조업 부진 깊고 넓다...68개 업종중 80% 가동률 급락 '고용 악순환' - 제조업 부진이 고용 시장 회복의 발목을 잡고 있는 것이다. 이같은 현상의 원인 중 하나는 가동률 상승 업종의 고용 인원이 하락 업종 대비 크게 적기 때문이다.
파크시스템스 기업정보 - 직원수, 근무환경, 복리후생 등 | 잡코리아 - 표준산업 분류 기준 [ 기타 측정 , 시험 , 항해 , 제어 및 정밀기기 제조업 ]의 공시된 재무정보(매출액)를 기준으로 평가된 순위입니다.
1. FinanceDataReader를 통한 상장종목 전체 불러오기.ipynb - Colab - Sector 소프트웨어 개발 및 공급업 89 금융 지원 서비스업 71 의약품 제조업 38 Name: 서울특별시, dtype: int64. spark Gemini.
(주) 웨이브일렉트로닉스 2025년 기업정보 | 직원수, 근무환경, 복리후생... - 측정 , 시험 , 항해 , 제어 및 기타 정밀기기 제조업 .이동통신중계기용전력증폭기,유도무기용 ","케이씨는 반도체 및 디스플레이 장비 산업의 성장에 기여하며, 지속가능경영을 통해 지속적인 발전을 추구하는 회사입니다. 주요 제품은 가스 및 화학 물질 공급 장치이며, 다양한 관계사들과 함께 성장하고 있습니다. 또한, 인재 채용과 복리후생에도 힘쓰고 있습니다.",판단실패,"홈페이지 상단에 'KC' 로고가 반복적으로 사용되고 있으며, 제품 소개 및 회사 소개에도 'KC'라는 명칭이 사용되고 있습니다. 또한 검색 결과에서도 KC라는 명칭이 사용되고 있어, 대중적으로 KC라는 이름으로 더 잘 알려져 있을 가능성이 높습니다."
케이씨씨,2380,기타 화학제품 제조업,"건축용단열재,내외장재,스레트,밤라이트,암면,석고보드,판유리 제조","정몽진, 정재훈",http://www.kccworld.co.kr,서울특별시,KCC,"通販・テレビショッピングの ショップ チャンネル - 24時間放送、テレビショッピングでお馴染みの ショップ チャンネルの通販サイト。 テレビ通販と連動して世界中から集めた厳選商品を皆様にお届けします。
Shop | The most amazing way to shop online - Shop from top brands, earn exclusive rewards, and track your packages all in one place. Now available on iOS, Android, and web.
Leading Online Shopping Platform In Southeast Asia & Taiwan ... - Shopee is the leading e-commerce online shopping platform in Southeast Asia and Taiwan. It provides customers with an easy, secure and fast online shopping exp","KCC는 건축용 단열재, 내외장재 등 다양한 화학 제품을 제조하는 기업입니다. 홈페이지에서는 제품 정보, 기술 자료, 기업 윤리, 투자 정보 등을 제공하며, 지속적인 혁신과 고객 만족을 추구하는 모습을 보여줍니다. 또한, 글로벌 시장 진출과 사회적 책임 이행에도 힘쓰고 있습니다.",판단실패,"검색 결과에서 'Shop' 관련 내용들은 쇼핑 플랫폼 이름일 가능성이 높고, 회사 정보와 제품군을 고려했을 때 건축 자재 및 화학 제품을 생산하는 KCC라는 이름으로 더 널리 알려져 있을 가능성이 높습니다."
케이씨텍,281820,"측정, 시험, 항해, 제어 및 기타 정밀기기 제조업; 광학기기 제외","반도체, 디스플레이 제조 장비","양호근, 최동규 (각자 대표이사)",http://www.kctech.co.kr,경기도,케이씨텍 (KCTech),"Jupiter - Wikipedia - Jupiter is the fifth planet from the Sun and the largest in the Solar System. It is a gas giant with a mass nearly 2.5 times that of all the other planets in the Solar System combined and slightly …
Formation of Jupiter - Wikipedia - Formation of Jupiter Artist's depiction of a gas giant in formation; Jupiter may have appeared similar during its early stages. The formation of Jupiter is led by processes that largely follow …
7 Important Dates in Jupiter History | Britannica","케이씨텍은 반도체 및 디스플레이 제조 장비, 소재를 연구개발 및 생산하는 기업입니다. 지속가능경영을 통해 사회에 기여하고 있으며, 고객 만족과 기술 발전을 추구합니다. 또한, 열정과 책임감을 갖춘 인재를 채용하여 함께 성장하는 것을 목표로 합니다.",예,"회사명과 홈페이지에 명시된 'KCTech'라는 명칭이 일관되게 사용되고 있으며, 검색 결과에서도 회사와 관련된 정보를 찾을 때 'KCTech'라는 이름이 사용되고 있어 대중적으로 더 널리 알려진 이름으로 판단됩니다. 업종, 주요 제품, 대표자명 등 다른 정보와도 부합합니다."
케이씨티시,9070,도로 화물 운송업,"화물자동차운송,항만하역,창고보관,컨테이너조작,중량물해상운송",류주환,http://www.kctc.co.kr,서울특별시,** WeGame,"WeGame - 一起更好玩 WeGame More - WeGame是中国最大的PC游戏平台。 我们致力于给玩家带来更多高品质游戏和更好游玩体验，为开发者和运营商提供全生命周期的游戏发行和运营服务。
WeGame - Windows官方下载 | 微软应用商店 | Microsoft Store - 1、WeGame腾讯游戏平台面向全球和国内玩家，直接连接游戏开发商和用户，为两者创造更多的交流和互动。 2、WeGame腾讯游戏平台提供一站式服务，包括游戏资讯、购买、下载、助手 …
【 WeGame （原TGP）下载】2025年最新官方正式版 ... - Sep 26, 2025 · WeGame是国内最大的数字游戏发行平台，集游戏购买下载、游戏社区等功能于一身，为游戏开发者提供更好的服务，为游戏玩家提供更多优质游戏内容，构筑开发者和游戏玩 …
wegame 下载 - 官方正版赛事聚合快速体验 - wegame下载页面，wegame整合娱乐与体育电竞，wegame官网首页提供官方正版入口。 高清画质、极速更新和赛事同步，让用户第一时间掌握热门游戏与权威赛事信息。
wegame - 官方正",** 홈페이지 접속에 실패하여 내용을 확인할 수 없습니다.,** 아니오,"** 검색 결과에서 'WeGame'이 중국 PC 게임 플랫폼으로 반복적으로 언급되고 있으며, 케이씨티시(KCTC)는 도로 화물 운송업체이므로, 이름이 일치하지 않습니다."
케이카,381970,자동차 판매업,오프라인 및 온라인 중고차 매매업,정인국,http://www.kcar.com,서울특별시,K Car,"케이카 - 위키백과, 우리 모두의 백과사전 - 분류: 한국거래소 상장 기업 대한민국의 도매업체 대한민국의 전자 상거래 기업 2017년 설립된 기업 2021년 상장된 기업 서울특별시의 기업
케이카 - K Car - 대한민국 No.1 직영 중고차 - 국내 최대 규모 직영 중고차 매매 플랫폼 K Car, 하루만에 중고차 사고 팔고, 온라인 구매 집앞배송, 3일 책임환불, 최대2년보증
K Car - 케이카 직영중고차 - Google Play 앱 - 대한민국 직영중고차 K Car! 위약금 없는 100% 환불, 최대 2년 품질 보증으로 중고차 구매 후까지 K Car가 책임집니다.
K Car - 케이카 직영중고차 on the App Store - 대한민국 직영중고차 K Car! 위약금 없는 100% 환불, 최대 2년 품질 보증으로 중고차 구매 후까지 K Car가 책임집니다. 전문 차량평가사가 직접 매입, 진단한 직영중고차만 엄선 판매하는 K Car에서 클래스 다른 중고차 쇼핑을 경험해 보세요. ","K Car는 대한민국 No.1 직영 중고차 딜러로서, 온라인 플랫폼을 통해 중고차를 쉽고 빠르게 사고 팔 수 있는 서비스를 제공합니다. 무료 차량평가, 당일 입금, 위약금 없는 100% 환불, 최대 2년 보증 등 다양한 혜택을 제공하며, 전국 직영점을 통해 편리한 서비스를 제공하고 있습니다.",판단실패,"검색 결과 및 홈페이지 내용에서 'K Car'라는 이름이 '케이카'보다 훨씬 더 자주 사용되고 있으며, 핵심적인 브랜드 이미지로 사용되고 있습니다. 또한, 회사 정보에 '케이카'라는 회사명이 명시되어 있지만, 실제 서비스 및 마케팅 활동은 'K Car'라는 이름으로 집중되고 있습니다."
케이티,30200,전기 통신업,"유무선통신사업,공중전기통신사업,인터넷,전자상거래,네트워크(전용회선,데이터통신,초고속사업 등)",김영섭,http://www.kt.com,경기도,KT,"세종텔레콤 - 위키백과, 우리 모두의 백과사전 - 1992년 6월 설립된 세종텔레콤 주식회사는 세종그룹 계열 전기 ·통신·소방 설비 시공 및 토목공사 전문 기업이다. 2000년 코스닥에 상장되었으며, 전력 인프라 구축 및 전기설비 시공을 핵심 사업으로 영위한다.
(주) 케이티 2025년 기업정보 | 직원수, 근무환경, 복리후생 등 - 사람인 - 유무선통신사업 , 공중전기통신사업 , 인터넷 , 전자상거래 , 네트워크 ( 전용회선 , 데이터통신 , 초고속사업 등 ).28GHz 대역에서 5G 네트워크 필드 검증 성공. 2019.
중국전용선 ･ 국제전용회선 서비스 | 차이나커넥트| 라스컴 - 한중 국제 전용회선 서비스 차이나커넥트의 대표 네트워크 상품 및 서비스를 소개합니다.
네트워크 통신방식 3가지: 단방향 통신: 정보전달이 한쪽 방향에서... - 인터넷 서비스에는 파일 전송, 전자 우편, 소셜 네트워크 서비스, 인터넷 전화, TV 등이 있다.
사내 전산실 (IDC!?) | SharedI","KT 홈페이지는 다양한 통신 서비스를 제공하며, 고객에게 편리하고 혁신적인 디지털 경험을 제공하는 데 중점을 두고 있습니다. 홈페이지는 고객 지원, 상품 안내, 뉴스 및 이벤트 정보 등을 제공하며, 한국어와 다양한 언어로 서비스를 제공합니다. 또한, KT의 사회 공헌 활동 및 지속 가능한 경영 노력에 대한 정보도 확인할 수 있습니다.",판단실패,"검색 결과와 회사 정보에서 KT라는 명칭이 일관되게 사용되고 있으며, 통신 사업을 주력으로 하는 기업으로서 대중적인 인지도가 높습니다."
케이티스카이라이프,53210,텔레비전 방송업,위성방송서비스,양춘식,http://www.ktskylife.co.kr,서울특별시,스카이라이프,"직원에게 직접 듣는다! 'TUV SUD Korea, 어떤 회사인가요 ?... - YouTube - О сервисе Прессе Авторские права Связаться с нами Авторам Рекламодателям...
Fever는 어떤 회사인가요 ? – Fever - Fever는 여러분이 도시에서 무엇을 하고, 어디에 가고, 무엇을 방문할 수 있는지를 발견하도록 도와줍니다.
블라인드 | 대원방송 기업정보 - 대원방송은(는) 일해 보고 싶은 회사인가요 ? What it means...홈페이지 anionetv.com. 업계 방송업 . 본사 서울특별시 마포구. 설립 2001.
중소기업특별세액 감면, 중요한 내용을 알려드릴게요 – 비즈넵 환급... - 비즈넵 케어의 세무파트너 지수회계법인은 어떤 회사인가요 ? 방송업 . 전기통신업.
B2B 기업 맞춤형 IT장비 견적 및 유지보수 전문 | 인성아이티 - 인성아이티는 어떤 회사인가요 ? 기업고객을 대상으로 기업에서 필요한 IT ","케이티 스카이라이프는 고객에게 즐거움과 감동을 전하는 종합 디지털 사업자로서, 국내 최다 HD 채널과 다양한 방송 콘텐츠를 제공하며 지속가능한 미래를 위해 노력하고 있습니다. 또한 고객과의 소통을 위해 다양한 소셜 채널을 운영하며, 스마트 미디어 분야의 선두주자로서 인재를 채용하고 있습니다.",판단실패,"검색 결과와 홈페이지 내용 모두에서 '스카이라이프'라는 이름이 지속적으로 사용되고 있으며, 이는 회사의 주요 서비스 및 브랜드로 인식되고 있음을 보여줍니다. 업종이 위성방송서비스이고, 홈페이지에서도 '국내 최다 HD채널, 국내 최강 olleh tv skylife' 와 같이 '스카이라이프'라는 이름이 강조되고 있어, 대중적으로 더 널리 알려진 이름으로 판단됩니다."
케이티앤지,33780,담배 제조업,"잎담배,제조담배,홍삼,홍삼제품 제조,판매","Baek, Bok-In",http://www.ktng.com,대전광역시,KT&G,"Mahavatar Narsimha - Wikipedia - Mahavatar Narsimha is a 2024 [c] Indian animated epic mythological action film directed by Ashwin Kumar in his directorial debut, written by Jayapurna Das and produced by Kleem …
Mahavatar Narsimha (2024) - IMDb - Aug 1, 2025 · Combining striking visuals, sacred storytelling, and emotionally charged music, the film is a rare gem in Indian animation that not only entertains but also inspires awe and …
MAHAAVATAR NARSHIMHA || FULL MOVIE IN HINDI - YouTube - 🔥 Prese","KT&G는 글로벌 담배 제조 기업으로, 148개국에 수출하며 다양한 브랜드와 제품을 보유하고 있습니다. 지속가능한 경영을 추구하며 ESG 경영을 강화하고 있으며, 문화예술 지원 및 사회공헌 활동에도 적극적으로 참여하고 있습니다. 또한, 투자 정보 및 재무 정보를 투명하게 공개하며 주주 가치 제고에 힘쓰고 있습니다.",판단실패,"검색 결과에서 'Mahavatar Narsimha'라는 영화와 관련된 내용이 검색되었지만, 이는 KT&G와는 전혀 관련이 없습니다. 홈페이지 및 회사 정보에서 명확하게 'KT&G'라는 이름으로 활동하고 있으며, 대중적으로도 KT&G라는 이름으로 널리 알려져 있습니다. 따라서 'KT&G'가 대중적인 이름으로 적절하다고 판단됩니다."
코리아써키트,7810,전자부품 제조업,"인쇄회로기판,Module 제조/부동산(건물) 임대",장세준,http://www.kcg.co.kr,경기도,코리아닷컴,"코리아닷컴 korea.com - 코리아닷컴에서 다양하고 유용한 정보와 함께 국가도메인 메일을 사용해보세요
- 코리아 메일 - 대한민국 대표메일의 자부심 - 받은편지함 보낸편지함 수신확인 임시편지함 청구서함 스팸편지함 휴지통
코리아닷컴 - 코리아는 당신을 사랑합니다. - 08506 서울시 금천구 가산디지털2로 98 롯데IT캐슬 2동 12층 1211호 │대표이사 : 김정주,김은경 고객센터 (팩스) : 02-2085-0701 사업자등록번호 : 214-86-80927 Copyrightⓒ ㈜코리아닷컴커뮤니케이션즈 All rights reserved.
코리아닷컴 - 코리아닷컴에서 다양하고 유용한 정보와 함께 국가도메인 메일을 사용해보세요
korea.com 뉴스 - [GJ포토] 모델 김효우, '블루빛 매력녀' (더룩오브더이어 코리아 프랑스 니스 화보) [GJ포토] 모델 김혜란, '패셔너블한 비주얼' (더룩오브더이어 코리아 프랑스 니스 화보) [GJ포토] 모델 김정희, '클래식 대상의 남다른 미모","코리아닷컴은 국가 도메인 메일 서비스를 제공하며, 다양한 정보와 함께 편리한 메일 기능을 제공합니다. 사용자에게 유용한 정보와 서비스를 제공하는 것을 목표로 하고 있으며, 대한민국 대표 메일 서비스임을 강조하고 있습니다. 롯데IT캐슬에 위치하고 있으며, 김정주, 김은경 대표이사를 두고 있습니다.",아니오,"검색 결과에서 '코리아닷컴'이 나타나지만, 이는 코리아닷컴커뮤니케이션즈라는 별개의 회사이며, 제시된 회사 정보(코리아써키트)와는 관련이 없습니다. 코리아써키트는 전자부품 제조업체입니다."
